{
  "role": "AI_ENGINE",
  "current_driver": "gemini",
  "description": "Handles reasoning, orchestration, and LLM execution with multi-model support",
  "altitude": "20k",
  "status": "active",
  "health": {
    "status": "connected",
    "latency_ms": 187,
    "last_check": "2025-10-23T14:32:18Z",
    "issues": []
  },
  "interface_contract": {
    "input": "structured_prompt (string | object)",
    "output": "json_result (object with text, metadata, usage)",
    "methods": [
      "generate_text",
      "analyze_content",
      "execute_reasoning",
      "multi_step_planning"
    ]
  },
  "supported_drivers": [
    {
      "name": "gemini",
      "version": "2.5-flash",
      "provider": "Google AI",
      "status": "active"
    },
    {
      "name": "claude",
      "version": "sonnet-4.5",
      "provider": "Anthropic",
      "status": "configured"
    },
    {
      "name": "gpt",
      "version": "4-turbo",
      "provider": "OpenAI",
      "status": "available"
    }
  ],
  "ort_manual": "/manual/ort-manuals/ai_engine.ort.md",
  "status_endpoint": "/manual/troubleshooting/system_diagnostics.json#ai_engine",
  "barton_doctrine_compliance": {
    "composio_mcp_integration": true,
    "heir_orbt_tracking": true,
    "multi_model_support": true
  },
  "metadata": {
    "last_updated": "2025-10-23T00:00:00Z",
    "maintainer": "Barton Doctrine Authority",
    "documentation_url": "https://github.com/djb258/imo-creator/tree/master/docs"
  }
}
